"4S8CXI6P","journalArticle","2010","Marwala, Lufuno Ronald","Forecasting the Stock Market Index Using Artificial Intelligence Techniques","","","","","","The weak form of Efficient Market hypothesis (EMH) states that it is impossible to forecast the future price of an asset based on the information contained in the historical prices of an asset. This means that the market behaves as a random walk and as a result makes forecasting impossible. Furthermore, financial forecasting is a difficult task due to the intrinsic complexity of the financial system. The objective of this work was to use artificial intelligence (AI) techniques to model and predict the future price of a stock market index. Three artificial intelligence techniques, namely, neural networks (NN), support vector machines and neuro-fuzzy systems are implemented in forecasting the future price of a stock market index based on its historical price information. Artificial intelligence techniques have the ability to take into consideration financial system complexities and they are used as financial time series forecasting tools. Two techniques are used to benchmark the AI techniques, namely, Autoregressive Moving Average (ARMA) which is linear modelling technique and random walk (RW) technique. The experimentation was performed on data obtained from the Johannesburg Stock Exchange. The data used was a series of past closing prices of the All Share Index. The results showed that the three techniques have the ability to predict the future price of the Index with an acceptable accuracy. All three artificial intelligence techniques outperformed the linear model. However, the random walk method outperfomed all the other techniques. These techniques show an ability to predict the future price however, because of the transaction costs of trading in the market, it is not possible to show that the three techniques can disprove the weak form of market efficiency. The results show that the ranking of performances support vector machines, neuro-fuzzy systems, multilayer perceptron neural networks is dependent on the accuracy measure used.","2010","2020-11-13 12:19:26","2020-11-29 10:42:48","","166","","","","","","","","","","","","","en","","","","","Zotero","","","","C:\Users\ruben\Zotero\storage\VAPXP46E\Marwala - Forecasting the Stock Market Index Using Artificia.pdf","","","","","","","","","","","","","","","","","","","","","","","","","","","","","","","","","","","","","","","","","","","","","","","","",""
"KNR44AJQ","webpage","2020","Santos, Marco","Using Deep Learning AI to Predict the Stock Market","Medium","","","","","Forecasting Stock Prices with Neural Networks containing Multivariable Inputs from Technical Analysis","2020-09-22","2020-11-13 12:20:04","2020-11-29 10:52:53","2020-11-13 12:20:04","","","","","","","","","","","","","","en","","","","","","","","","C:\Users\ruben\Zotero\storage\DNUZX6DH\using-deep-learning-ai-to-predict-the-stock-market-9399cf15a312.html","","","","","","","","","","","","","","","","","","","","","","","","","","","","","","","","","","","","","","","","","","","","","","","","",""
"Q6IHMQ5X","journalArticle","2011","Razali, Noraini Mohd; Geraghty, John","Genetic Algorithm Performance with Different Selection Strategies in Solving TSP","","","","","","A genetic algorithm (GA) has several genetic operators that can be modified to improve the performance of particular implementations. These operators include parent selection, crossover and mutation. Selection is one of the important operations in the GA process. There are several ways for selection. This paper presents the comparison of GA performance in solving travelling salesman problem (TSP) using different parent selection strategy. Several TSP instances were tested and the results show that tournament selection strategy outperformed proportional roulette wheel and rankbased roulette wheel selections, achieving best solution quality with low computing times. Results also reveal that tournament and proportional roulette wheel can be superior to the rankbased roulette wheel selection for smaller problems only and become susceptible to premature convergence as problem size increases.","2011","2020-11-16 10:51:36","2020-11-16 10:51:37","","6","","","","","","","","","","","","","en","","","","","Zotero","","","","C:\Users\ruben\Zotero\storage\IMTU5K3E\Razali y Geraghty - 2011 - Genetic Algorithm Performance with Different Selec.pdf","","","","","","","","","","","","","","","","","","","","","","","","","","","","","","","","","","","","","","","","","","","","","","","","",""
"S72FNI86","journalArticle","2012","Kumar, Rakesh; Jyotishree","Blending Roulette Wheel Selection & Rank Selection in Genetic Algorithms","International Journal of Machine Learning and Computing","","20103700","10.7763/IJMLC.2012.V2.146","","Both exploration and exploitation are the techniques employed normally by all the optimization techniques. In genetic algorithms, the roulette wheel selection operator has essence of exploitation while rank selection is influenced by exploration. In this paper, a blend of these two selection operators is proposed that is a perfect mix of both i.e. exploration and exploitation. The blended selection operator is more exploratory in nature in initial iterations and with the passage of time, it gradually shifts towards exploitation. The proposed solution is implemented in MATLAB using travelling salesman problem and the results were compared with roulette wheel selection and rank selection with different problem sizes.","2012","2020-11-16 13:49:53","2020-11-29 10:52:28","2020-11-16 13:49:53","365-370","","","","","IJMLC","","","","","","","","en","","","","","DOI.org (Crossref)","","","","C:\Users\ruben\Zotero\storage\3DV5MMYP\Kumar y Jyotishree - 2012 - Blending Roulette Wheel Selection & Rank Selection.pdf","","","","","","","","","","","","","","","","","","","","","","","","","","","","","","","","","","","","","","","","","","","","","","","","",""
"SFYA59SI","conferencePaper","2015","Shukla, A.; Pandey, H. M.; Mehrotra, D.","Comparative review of selection techniques in genetic algorithm","2015 International Conference on Futuristic Trends on Computational Analysis and Knowledge Management (ABLAZE)","","","10.1109/ABLAZE.2015.7154916","","This paper compares various selection techniques used in Genetic Algorithm. Genetic algorithms are optimization search algorithms that maximize or minimizes given functions. Indentifying the appropriate selection technique is a critical step in genetic algorithm. The process of selection plays an important role in resolving premature convergence because it occurs due to lack of diversity in the population. Therefore selection of population in each generation is very important. In this study, we have reported the significant work conducted on various selection techniques and the comparison of selection techniques.","2015-02","2020-11-16 14:02:07","2020-11-16 14:02:07","","515-519","","","","","","","","","","","","","","","","","","IEEE Xplore","","","","C:\Users\ruben\Zotero\storage\UXKGHRS8\Shukla et al. - 2015 - Comparative review of selection techniques in gene.pdf; C:\Users\ruben\Zotero\storage\8GEYD4TJ\7154916.html","","","genetic algorithm; genetic algorithms; Genetic algorithms; Wheels; Convergence; Genetic Algorithm; Knowledge management; Market research; optimization search algorithms; premature convergence; proportionate roulette wheel selection; Ranking Selection; search problems; selection techniques; Sociology; Statistics; tournament selection","","","","","","","","","","","","","","","","","","","","","","","","","","","","","","","2015 International Conference on Futuristic Trends on Computational Analysis and Knowledge Management (ABLAZE)","","","","","","","","","","","","","","",""
"HNIEPJLV","book","2015","Sucar, Luis Enrique","Probabilistic Graphical Models: Principles and Applications","","978-1-4471-6699-3","","","","This accessible text/reference provides a general introduction to probabilistic graphical models (PGMs) from an engineering perspective. The book covers the fundamentals for each of the main classes of PGMs, including representation, inference and learning principles, and reviews real-world applications for each type of model. These applications are drawn from a broad range of disciplines, highlighting the many uses of Bayesian classifiers, hidden Markov models, Bayesian networks, dynamic and temporal Bayesian networks, Markov random fields, influence diagrams, and Markov decision processes. Topics and features: Presents a unified framework encompassing all of the main classes of PGMs Explores the fundamental aspects of representation, inference and learning for each technique Describes the practical application of the different techniques Examines the latest developments in the field, covering multidimensional Bayesian classifiers, relational graphical models and causal models Provides exercises, suggestions for further reading, and ideas for research or programming projects at the end of each chapter Suggests possible course outlines for instructors in the preface This classroom-tested work is suitable as a textbook for an advanced undergraduate or a graduate course in probabilistic graphical models for students of computer science, engineering, and physics. Professionals wishing to apply probabilistic graphical models in their own field, or interested in the basis of these techniques, will also find the book to be an invaluable reference. Dr. Luis Enrique Sucar is a Senior Research Scientist at the National Institute for Astrophysics, Optics and Electronics (INAOE), Puebla, Mexico","2015","2020-11-18 11:02:48","2020-11-18 11:02:48","","","1","","","","","Probabilistic Graphical Models","Advances in Computer Vision and Pattern Recognition","","","","Springer London : Imprint: Springer","London","","","","","","Library of Congress ISBN","005.55","DOI: 10.1007/978-1-4471-6699-3","","","","","Artificial intelligence; Artificial Intelligence; Electrical engineering; Electrical Engineering; Mathematical statistics; Pattern recognition; Pattern Recognition; Probabilities; Probability and Statistics in Computer Science; Probability Theory and Stochastic Processes","","","","","","","","","","","","","","","","","","","","1st ed. 2015","","","","","","","","","","","","","","","","","","","","","","","","","",""
"XXAZBVCN","journalArticle","2011","Collobert, Ronan; Weston, Jason; Bottou, Léon; Karlen, Michael; Kavukcuoglu, Koray; Kuksa, Pavel","Natural Language Processing (Almost) from Scratch","The Journal of Machine Learning Research","","1532-4435","","","We propose a unified neural network architecture and learning algorithm that can be applied to various natural language processing tasks including part-of-speech tagging, chunking, named entity recognition, and semantic role labeling. This versatility is achieved by trying to avoid task-specific engineering and therefore disregarding a lot of prior knowledge. Instead of exploiting man-made input features carefully optimized for each task, our system learns internal representations on the basis of vast amounts of mostly unlabeled training data. This work is then used as a basis for building a freely available tagging system with good performance and minimal computational requirements.","2011-11-01","2020-11-21 10:05:49","2020-11-21 10:05:49","","2493–2537","","null","12","","J. Mach. Learn. Res.","","","","","","","","","","","","","2/1/2011","","","","C:\Users\ruben\Zotero\storage\5ZJR8CUA\Collobert et al. - 2011 - Natural Language Processing (Almost) from Scratch.pdf","","","","","","","","","","","","","","","","","","","","","","","","","","","","","","","","","","","","","","","","","","","","","","","","",""
"8HE25YPQ","webpage","2017","Furqan, Mhd; Hartono, H.; Ongko, Erianto; Ikhsan, M.","Performance of Arithmetic Crossover and Heuristic Crossover in Genetic Algorithm Based on Alpha Parameter","undefined","","","","","Genetic algorithm (GA) is a heuristic search algorithm based on the idea of natural selection that  occurs in the process of evolution and genetic operations. One of the critical stages in the genetic algorithm is a crossover process. In the crossover, phase occurs the gene mix between the parent that it will determine the  diversity in the population. This paper will describe the effects of the alpha parameter in the crossover process  which includes arithmetic crossover and heuristic crossover. The Case studies that used in this study is the Traveling Salesman Problem (TSP). The influence of parameters on the performance of genetic algorithm alpha  is associated with gene diversity resulting from the crossover. The results showed that in the arithmetic  crossover, the best alpha value is 0.5, becoming the best alpha value because of a balanced genes combination  from both parents. On Heuristic Crossover obtained different results where the alpha value which gives the best performance is 0.9. This method slightly different from the Arithmetic Crossover caused on Heuristic  Crossover; the alpha parameter used as multiplier factor after the subtraction process of genes from both  parents.","2017","2020-11-24 08:52:21","2020-11-29 10:52:13","2020-11-24 08:52:21","","","","","","","","","","","","","","en","","","","","","","","","C:\Users\ruben\Zotero\storage\777JKTPV\903dce68eb97f50c3993305100c95d8607d1e459.html","","","","","","","","","","","","","","","","","","","","","","","","","","","","","","","","","","","","","","","","","","","","","","","","",""
"PFSZYJF7","journalArticle","2013","Gestal, Marcos","Introduccion a los Algoritmos Geneticos","","","","","","","2013-08-13","2020-11-29 10:28:09","2020-11-29 10:28:09","","","","","","","","","","","","","","","","","","","","ResearchGate","","","","C:\Users\ruben\Zotero\storage\IGXDMJB4\Gestal - 2013 - Introduccion a los Algoritmos Geneticos.pdf; ","https://www.researchgate.net/publication/237812449_Introduccion_a_los_Algoritmos_Geneticos","","","","","","","","","","","","","","","","","","","","","","","","","","","","","","","","","","","","","","","","","","","","","","","",""
"RH5LKL6A","webpage","2007","McCarthy, John","Basic Questions","","","","","","","2007-11-12","2020-11-29 10:31:32","2020-11-29 10:52:33","2020-11-29 10:31:32","","","","","","","","","","","","","","","","","","","","","","","C:\Users\ruben\Zotero\storage\DDM8YVJV\node1.html","","","","","","","","","","","","","","","","","","","","","","","","","","","","","","","","","","","","","","","","","","","","","","","","",""
"39FUU956","journalArticle","2016","Moghaddam, Amin Hedayati; Moghaddam, Moein Hedayati; Esfandyari, Morteza","Stock market index prediction using artificial neural network","Journal of Economics, Finance and Administrative Science","","2077-1886","10.1016/j.jefas.2016.07.002","","In this study the ability of artificial neural network (ANN) in forecasting the daily NASDAQ stock exchange rate was investigated. Several feed forward ANNs that were trained by the back propagation algorithm have been assessed. The methodology used in this study considered the short-term historical stock prices as well as the day of week as inputs. Daily stock exchange rates of NASDAQ from January 28, 2015 to 18 June, 2015 are used to develop a robust model. First 70 days (January 28 to March 7) are selected as training dataset and the last 29 days are used for testing the model prediction ability. Networks for NASDAQ index prediction for two type of input dataset (four prior days and nine prior days) were developed and validated. Resumen En este estudio se investigó la capacidad de previsión del índice bursátil diario NASDAQ, por parte de la red neuronal artificial (RNA). Se evaluaron diversas RNA proalimentadas, que fueron entrenadas mediante un algoritmo de retropropagación. La metodología utilizada en este estudio consideró como inputs los precios bursátiles históricos a corto plazo, así como el día de la semana. Se utilizaron los índices bursátiles diarios de NASDAQ del 28 de enero al 18 de junio de 2015, para desarrollar un modelo robusto. Se seleccionaron los primeros 70 días (del 28 de enero al 7 de marzo) como conjuntos de datos de entrenamiento, y los últimos 29 días para probar la capacidad del modelo de predicción. Se desarrollaron y validaron redes para la predicción del índice NASDAQ, para dos tipos de conjuntos de datos de input (los cuatro y los nueve días previos).","2016-12-01","2020-11-29 10:41:56","2020-11-29 10:52:39","2020-11-29 10:41:56","89-93","","41","21","","Journal of Economics, Finance and Administrative Science","","","","","","","","en","","","","","ScienceDirect","","","","C:\Users\ruben\Zotero\storage\5P65IHJK\Moghaddam et al. - 2016 - Stock market index prediction using artificial neu.pdf; C:\Users\ruben\Zotero\storage\WTKC936M\S2077188616300245.html","","","ANN; NASDAQ; Predicción; Prediction","","","","","","","","","","","","","","","","","","","","","","","","","","","","","","","","","","","","","","","","","","","","","",""